{
  "schema_version": "1.0",
  "pptx": "/tmp/pptsmith-task6.F1Rx5h/python_pptx/delivery/deck.pptx",
  "slide_count": 9,
  "status": "passed",
  "metrics": {
    "native_text_character_count": 1413,
    "expected_text_character_count": 1051,
    "native_text_ratio": 1.0,
    "native_table_count": 1,
    "native_chart_count": 1,
    "native_connector_count": 2,
    "rasterized_area_ratio": 0.0,
    "whole_slide_raster_count": 0,
    "average_object_count": 3.4444
  },
  "slides": [
    {
      "slide_index": 1,
      "slide_id": "S01",
      "objects": [
        {
          "object_id": "ppt-object-1-1",
          "slide_id": "S01",
          "shape_id": 2,
          "shape_type": "text",
          "name": "TextBox 1",
          "x_in": 0.55,
          "y_in": 0.38,
          "w_in": 12.2,
          "h_in": 0.45,
          "area_ratio": 0.054901,
          "text": "One IR, two real builders",
          "font_sizes_pt": [
            22.0
          ],
          "fill_colors": [],
          "line_colors": [],
          "source_relationship": null,
          "font_families": [
            "Aptos"
          ],
          "image_ext": null,
          "image_px": null
        },
        {
          "object_id": "ppt-object-1-2",
          "slide_id": "S01",
          "shape_id": 3,
          "shape_type": "text",
          "name": "TextBox 2",
          "x_in": 0.55,
          "y_in": 1.05,
          "w_in": 11.7,
          "h_in": 0.5,
          "area_ratio": 0.058501,
          "text": "PPTSmith v2 shared builder acceptance deck.",
          "font_sizes_pt": [
            13.0
          ],
          "fill_colors": [],
          "line_colors": [],
          "source_relationship": null,
          "font_families": [
            "Aptos"
          ],
          "image_ext": null,
          "image_px": null
        }
      ],
      "metrics": {
        "native_text_character_count": 68,
        "expected_text_character_count": 68,
        "native_text_ratio": 1.0,
        "text_box_count": 2,
        "average_characters_per_text_box": 34.0,
        "small_text_box_count": 0,
        "font_family_count": 1,
        "font_size_count": 2,
        "object_count": 2,
        "tiny_object_count": 0,
        "text_boxes_per_100_characters": 2.9412,
        "rasterized_area_ratio": 0.0,
        "native_table_count": 0,
        "native_chart_count": 0,
        "native_connector_count": 0
      },
      "issues": []
    },
    {
      "slide_index": 2,
      "slide_id": "S02",
      "objects": [
        {
          "object_id": "ppt-object-2-1",
          "slide_id": "S02",
          "shape_id": 2,
          "shape_type": "text",
          "name": "TextBox 1",
          "x_in": 0.55,
          "y_in": 0.38,
          "w_in": 12.2,
          "h_in": 0.45,
          "area_ratio": 0.054901,
          "text": "Shared contracts make builder differences visible",
          "font_sizes_pt": [
            22.0
          ],
          "fill_colors": [],
          "line_colors": [],
          "source_relationship": null,
          "font_families": [
            "Aptos"
          ],
          "image_ext": null,
          "image_px": null
        },
        {
          "object_id": "ppt-object-2-2",
          "slide_id": "S02",
          "shape_id": 3,
          "shape_type": "text",
          "name": "TextBox 2",
          "x_in": 0.55,
          "y_in": 1.05,
          "w_in": 11.7,
          "h_in": 0.5,
          "area_ratio": 0.058501,
          "text": "One semantic deck can produce truthful, editable packages through both adapters.\nAcceptance evidence is explicit and inspectable.",
          "font_sizes_pt": [
            13.0
          ],
          "fill_colors": [],
          "line_colors": [],
          "source_relationship": null,
          "font_families": [
            "Aptos"
          ],
          "image_ext": null,
          "image_px": null
        },
        {
          "object_id": "ppt-object-2-3",
          "slide_id": "S02",
          "shape_id": 4,
          "shape_type": "text",
          "name": "Rounded Rectangle 3",
          "x_in": 0.55,
          "y_in": 1.85,
          "w_in": 3.6,
          "h_in": 1.35,
          "area_ratio": 0.048601,
          "text": "Contract-first: Compare outputs without hiding route deviations.",
          "font_sizes_pt": [
            13.0
          ],
          "fill_colors": [
            "#F2EADF"
          ],
          "line_colors": [],
          "source_relationship": null,
          "font_families": [
            "Aptos"
          ],
          "image_ext": null,
          "image_px": null
        }
      ],
      "metrics": {
        "native_text_character_count": 242,
        "expected_text_character_count": 161,
        "native_text_ratio": 1.0,
        "text_box_count": 3,
        "average_characters_per_text_box": 80.6667,
        "small_text_box_count": 0,
        "font_family_count": 1,
        "font_size_count": 2,
        "object_count": 3,
        "tiny_object_count": 0,
        "text_boxes_per_100_characters": 1.2397,
        "rasterized_area_ratio": 0.0,
        "native_table_count": 0,
        "native_chart_count": 0,
        "native_connector_count": 0
      },
      "issues": []
    },
    {
      "slide_index": 3,
      "slide_id": "S03",
      "objects": [
        {
          "object_id": "ppt-object-3-1",
          "slide_id": "S03",
          "shape_id": 2,
          "shape_type": "text",
          "name": "TextBox 1",
          "x_in": 0.55,
          "y_in": 0.38,
          "w_in": 12.2,
          "h_in": 0.45,
          "area_ratio": 0.054901,
          "text": "Evidence is counted, not implied",
          "font_sizes_pt": [
            22.0
          ],
          "fill_colors": [],
          "line_colors": [],
          "source_relationship": null,
          "font_families": [
            "Aptos"
          ],
          "image_ext": null,
          "image_px": null
        },
        {
          "object_id": "ppt-object-3-2",
          "slide_id": "S03",
          "shape_id": 3,
          "shape_type": "text",
          "name": "TextBox 2",
          "x_in": 0.55,
          "y_in": 1.05,
          "w_in": 11.7,
          "h_in": 0.5,
          "area_ratio": 0.058501,
          "text": "Acceptance evidence must connect manifests to inspected packages.\nAcceptance evidence is explicit and inspectable.",
          "font_sizes_pt": [
            13.0
          ],
          "fill_colors": [],
          "line_colors": [],
          "source_relationship": null,
          "font_families": [
            "Aptos"
          ],
          "image_ext": null,
          "image_px": null
        },
        {
          "object_id": "ppt-object-3-3",
          "slide_id": "S03",
          "shape_id": 4,
          "shape_type": "text",
          "name": "Rounded Rectangle 3",
          "x_in": 0.55,
          "y_in": 1.85,
          "w_in": 3.6,
          "h_in": 1.35,
          "area_ratio": 0.048601,
          "text": "Slides inspected: 9",
          "font_sizes_pt": [
            13.0
          ],
          "fill_colors": [
            "#F2EADF"
          ],
          "line_colors": [],
          "source_relationship": null,
          "font_families": [
            "Aptos"
          ],
          "image_ext": null,
          "image_px": null
        },
        {
          "object_id": "ppt-object-3-4",
          "slide_id": "S03",
          "shape_id": 5,
          "shape_type": "text",
          "name": "Rounded Rectangle 4",
          "x_in": 4.31,
          "y_in": 1.85,
          "w_in": 3.6,
          "h_in": 1.35,
          "area_ratio": 0.048601,
          "text": "Builders exercised: 2",
          "font_sizes_pt": [
            13.0
          ],
          "fill_colors": [
            "#F2EADF"
          ],
          "line_colors": [],
          "source_relationship": null,
          "font_families": [
            "Aptos"
          ],
          "image_ext": null,
          "image_px": null
        }
      ],
      "metrics": {
        "native_text_character_count": 186,
        "expected_text_character_count": 120,
        "native_text_ratio": 1.0,
        "text_box_count": 4,
        "average_characters_per_text_box": 46.5,
        "small_text_box_count": 0,
        "font_family_count": 1,
        "font_size_count": 2,
        "object_count": 4,
        "tiny_object_count": 0,
        "text_boxes_per_100_characters": 2.1505,
        "rasterized_area_ratio": 0.0,
        "native_table_count": 0,
        "native_chart_count": 0,
        "native_connector_count": 0
      },
      "issues": []
    },
    {
      "slide_index": 4,
      "slide_id": "S04",
      "objects": [
        {
          "object_id": "ppt-object-4-1",
          "slide_id": "S04",
          "shape_id": 2,
          "shape_type": "text",
          "name": "TextBox 1",
          "x_in": 0.55,
          "y_in": 0.38,
          "w_in": 12.2,
          "h_in": 0.45,
          "area_ratio": 0.054901,
          "text": "Native tables remain editable",
          "font_sizes_pt": [
            22.0
          ],
          "fill_colors": [],
          "line_colors": [],
          "source_relationship": null,
          "font_families": [
            "Aptos"
          ],
          "image_ext": null,
          "image_px": null
        },
        {
          "object_id": "ppt-object-4-2",
          "slide_id": "S04",
          "shape_id": 3,
          "shape_type": "text",
          "name": "TextBox 2",
          "x_in": 0.55,
          "y_in": 1.05,
          "w_in": 11.7,
          "h_in": 0.5,
          "area_ratio": 0.058501,
          "text": "The table is a native-required acceptance object.\nAcceptance evidence is explicit and inspectable.",
          "font_sizes_pt": [
            13.0
          ],
          "fill_colors": [],
          "line_colors": [],
          "source_relationship": null,
          "font_families": [
            "Aptos"
          ],
          "image_ext": null,